,Unnamed: 0,Merit No,Marks,Application ID,Name of Candidate,Gender,Category,Category id,Seat Type,PWD/DEF,Sub Group,sub group name,cource_code,cource code name,college_code,Institute dict,Institute Name,Seat conformation,Seat conformation id
75,8231,7051,82.55,19128377,VARADE LALIT NANDU,M,NT3,9,DFNTD,,201,Civil,201,Civil,6028,Kolhapur,"Department of Technology, Shivaji University, Kolhapur",#,2.0
176,9566,14431,76.79,19139429,OMASE SIDDHANT TANAJI,M,NT3,9,GNTD,,201,Civil,201,Civil,6250,Kolhapur,"D.Y. Patil College of Engineering and Technology, Kolhapur",#,2.0
208,9607,7355,82.25,19134730,RAKH ROHINI SADASHIV,F,NT3,9,PHNTD,,201,Civil,201,Civil,6267,Kolhapur,"Kolhapur Institute of Technology's College of Engineering(Autonomous), Kolhapur",^,1.0
385,9982,28943,69.06,19125513,JADHAWAR SURAJ DATTATRAY,M,NT3,9,LNTD,,201,Civil,201,Civil,6288,Kolhapur,"Bharati Vidyapeeth's College of Engineering, Kolhapur",#,2.0
580,12595,23529,71.59,19128145,DONGRE KIRAN NAVNATH,M,NT3,9,DFNTD,,401,Machanical,201,Civil,6839,Kolhapur,"Dr. D Y Patil Pratishthan's College of Engineering, Kolhapur",&,4.0
813,21832,38244,65.06,19100619,KENDRE VAIBHAV SHIVAJI,M,NT3,9,DFNTD,,301,Computer & IT,301,Computer & IT,6267,Kolhapur,"Kolhapur Institute of Technology's College of Engineering(Autonomous), Kolhapur",#,2.0
1836,65403,39695,64.47,19120815,OMASE CHANDRAKANT SIDRAM,M,NT3,9,PHNTD,,401,Machanical,401,Machanical,6222,Kolhapur,"Dattajirao Kadam Technical Education Society's Textile & Engineering Institute, Ichalkaranji.",^,1.0
2515,73436,6351,83.19,19147626,AVHAD PRADNYA DASHARATH,F,NT3,9,LST,,701,Knitting Technology,701,Knitting Technology,6222,Kolhapur,"Dattajirao Kadam Technical Education Society's Textile & Engineering Institute, Ichalkaranji.",^,1.0
