"Sr. No","Institute Code","Institute Name"
309,6754,"International Institute of Information Technology (I2IT), Pune."
310,6755,"JSPM Narhe Technical Campus, Pune."
311,6756,"Fabtech Technical Campus College of Engineering and Research, Sangola"
312,6757,"Yashoda Technical Campus, Wadhe, Satara."
313,6758,"Sahyadri Valley College of Engineering & Technology, Rajuri, Pune."
314,6759,"Shree Ramchandra College of Engineering, Lonikand,Pune"
315,6762,"Nanasaheb Mahadik College of Engineering,Walwa, Sangli."
316,6766,"Phaltan Education Society's College of Engineering Thakurki Tal- Phaltan Dist-Satara"
317,6767,"Suman Ramesh Tulsiani Technical Campus: Faculty of Engineering, Kamshet,Pune."
318,6768,"P.K. Technical Campus, Pune."
319,6769,"Rasiklal M. Dhariwal Sinhgad Technical Institutes Campus, Warje, Pune."
320,6770,"SKN Sinhgad Institute of Technology & Science, Kusgaon(BK),Pune."
321,6772,"NBN Sinhgad Technical Institutes Campus, Pune"
322,6780,"D.Y.Patil Education Society's,D.Y.Patil Technical Campus, Faculty of Engineering & Faculty of Management,Talsande,Kolhapur."
323,6781,"Bhagwant Institute of Technology, Barshi"
324,6782,"Sahakar Maharshee Shankarrao Mohite Patil Institute of Technology & Research, Akluj"
325,6786,"Dr. D. Y. Patil School of Engineering & Technology, Charholi(Bk), Via Lohgaon, Pune"
326,6787,"Dr. D. Y. Patil Educational Academy's, D.Y.Patil School of Engineering Academy, Ambi"
327,6794,"Anantrao Pawar College of Engineering & Research, Pune"
328,6795,"Shri.Someshwar Shikshan Prasarak Mandals, Someshwar Engineering College, Someshwar Nagar"
329,6796,"Bharati Vidyapeeth's College of Engineering,Lavale, Pune"
330,6797,"Dnyanshree Institute Engineering and Technology, Satara"
331,6802,"Dr. D.Y.Patil Institute of Engineering, Management & Reseach, Akurdi, Pune"
332,6803,"Sant Gajanan Maharaj College of Engineering, Gadhinglaj"
333,6808,"Keystone School of Engineering, Pune"
334,6815,"Vidya Prasarini Sabha's College of Engineering & Technology, Lonavala"
335,6822,"Pimpri Chinchwad Education Trust's Pimpri Chinchwad College Of Engineering And Research, Ravet"
336,6834,"Dr.D.Y.Patil College Of Engineering & Innovation,Talegaon"
337,6839,"Dr. D Y Patil Pratishthan's College of Engineering, Kolhapur"
338,6878,"Dr. A. D. Shinde College Of Engineering, Tal.Gadhinglaj, Kolhapur"
339,6901,"MAEER's MIT College of Railway Engineering and Research, Jamgaon, Barshi"